pol_first_name,pol_middle_name,pol_last_name,pol_junior,photo_credit,polra_party,ra_number,pol_nat_id,polra_in_order,polra_number,pol_number,of_number,se_number,race_id,office_id,ra_num_winners,rt_number,rt_party_name,of_description,ot_number,ot_name,se_name,of_scope,race_order,el_date,ra_uncontested,ra_tabulate,st_postal,ra_national_b,ra_runoff_cands,pol_abbrv,incumbent,website,facebook,twitter,instagram,youtube,ballotpedia,currently,previously,sentence,photo_slug,race_to_watch,gg_link,gg_to_watch_link,wnyc_link,why_watch
Jon,,Ritter,,https://www.facebook.com/JonRitterForStateSenate/photos/a.1728529097385388.1073741825.1728528654052099/1742185592686405/?type=1&theater,GOP,,,,,,,,,,,,GOP,,,State Senate,District 54,L,6140,20160913,FALSE,TRUE,NY,FALSE,FALSE,Ritter,FALSE,http://ritterforstatesenate.com/,https://www.facebook.com/JonRitterForStateSenate/,N/A,N/A,N/A,N/A,"Monroe County Sherriff's Office; Airport Securty Unit, Greater Rochester International Airport",Greece police officer,Focused on the economy and changing the SAFE Act on gun control. Received recognition for responding to a shooting in West Webster in 2012.,,,,,,
Floyd,,Rayburn,,https://www.facebook.com/FloydRayburnForSenate/photos/a.1000330570053557.1073741826.1000330256720255/1060267380726542/?type=1&theater,GOP,,,,,,,,,,,,GOP,,,State Senate,District 54,L,6140,20160913,FALSE,TRUE,NY,FALSE,FALSE,Rayburn,FALSE,http://floydrayburnfornyssenate.com/,https://www.facebook.com/FloydRayburnForSenate/,N/A,N/A,N/A,N/A,Hopewell businessman,,"Recently endorsed by Unshackle Upstate, a pro-business group.",,,,,,
Christopher,L.,Jacobs,,https://en.wikipedia.org/wiki/Christopher_Jacobs_(politician),GOP,,,,,,,,,,,,GOP,,,State Senate,District 60,L,6580,20160913,FALSE,TRUE,NY,FALSE,FALSE,Jacobs,FALSE,http://www.chrisjacobsforsenate.com/,https://www.facebook.com/Jacobs4Senate/,https://twitter.com/eriecountyclerk,N/A,https://www.youtube.com/channel/UCe8eFZqn-yn1TbL4Tniebxg,N/A,Erie County Clerk,Secretary of State of New York,"Wants to create a bipartisan ""Reform Caucus"" with members from the Senate and Assembly. Won by large margins in two countywide races for clerk. Charter school advocate. Part of the wealthy Jacobs family in Buffalo.",,,,,,
Kevin,,Stocker,,https://ballotpedia.org/Kevin_T._Stocker,GOP,,,,,,,,,,,,GOP,,,State Senate,District 60,L,6580,20160913,FALSE,TRUE,NY,FALSE,FALSE,Stocker,FALSE,https://www.kstockeresq.com/senate/,https://www.facebook.com/KevinStockerforStateSenate/?pnref=story,N/A,,https://www.youtube.com/channel/UCWotfSf64qohiM6EQCqNWAQ,https://ballotpedia.org/Kevin_T._Stocker,Attorney,Kenmore Deputy Attorney,Recently sent a letter to state and federal officials alleging that Republican and Conservative party bosses have tried to intimidate him out of running. Narrowly lost in the general election for this seat in 2014.,,,,,,
Alfred,,Coppola,,https://ballotpedia.org/Alfred_T._Coppola,Dem,,,,,,,,,,,,Dem,,,State Senate,District 60,L,6570,20160913,FALSE,TRUE,NY,FALSE,FALSE,Coppola,FALSE,,https://www.facebook.com/alfred.t.coppola,,,N/A,https://ballotpedia.org/Alfred_T._Coppola,Business owner; Preservationist,Delaware Council member; State Senator,Lifelong Buffalo resident who is currently working to restore the South Buffalo Lighthouse. Narrowly lost the Democratic primary for this seat in 2014. ,,,,,,
Amber,,Small,,https://www.facebook.com/SmallforSenate/photos/a.1118001574897611.1073741830.1082539961777106/1250021251695642/?type=3&theater,Dem,,,,,,,,,,,,Dem,,,State Senate,District 60,L,6570,20160913,FALSE,TRUE,NY,FALSE,FALSE,Small,FALSE,http://www.smallforsenate.com/,https://www.facebook.com/SmallforSenate/?fref=ts,https://twitter.com/smallforsenate,https://www.instagram.com/smallforsenate/,https://www.youtube.com/channel/UCpSelRiJB1VDY5m3EHgqDug,,Executive Director of the Parkside Community Association,"Community Engagement Coordinator, Planned Parenthood of Western New York",Focused on environmental issues and ethics reform in Albany. Pushing for a state-funded clean up of Scajaquada Creek. Endorsed by the Stonewall Democrats.,,,,,,